{
  "$schema": "https://json-schema.org/draft/2020-12/schema",
  "$id": "https://snackdriven.dev/operator-core/schemas/doctrine-entry.schema.json",
  "title": "DoctrineEntry",
  "description": "A single Doctrine entry. Use this schema to validate one entry in isolation — for example a markdown file's YAML frontmatter under doctrine/. The aggregate Doctrine document (doctrine.schema.json) wraps an array of these.",
  "type": "object",
  "required": ["id", "kind", "title", "body"],
  "properties": {
    "id": {
      "type": "string",
      "pattern": "^[a-z0-9][a-z0-9_-]*$",
      "description": "Stable kebab-case id. Doctrine ids should not change once published; rename via 'replaces'."
    },
    "kind": {
      "type": "string",
      "enum": [
        "identity",
        "default",
        "workflow",
        "routing-rule",
        "voice-rule",
        "evergreen-reference",
        "policy",
        "vocabulary"
      ]
    },
    "title": { "type": "string", "minLength": 1 },
    "body": {
      "type": "string",
      "minLength": 1,
      "description": "Markdown content. Should remain low-churn; if churn is high, the entry probably belongs in Backpack instead."
    },
    "tags": {
      "type": "array",
      "items": { "type": "string" },
      "uniqueItems": true
    },
    "applies_to": {
      "type": "array",
      "description": "Renderer or surface ids this entry should govern.",
      "items": { "type": "string" }
    },
    "routing": {
      "type": "object",
      "description": "Optional routing rules, used when kind = 'routing-rule'.",
      "properties": {
        "when": { "type": "string" },
        "prefer_renderer": { "type": "string" },
        "narrator": { "type": "string" },
        "tone": { "type": "string" }
      },
      "additionalProperties": false
    },
    "consent": {
      "type": "object",
      "description": "Optional consent-posture definition, used when kind = 'policy' and the policy governs ingestion or rendering of sensitive material. Pathways MUST consult this before crossing the named scope; renderers MUST consult it before exposing material in the named scope.",
      "required": ["scope", "posture"],
      "properties": {
        "scope": {
          "type": "string",
          "description": "What this consent applies to (e.g. 'health-records', 'work-channel-transcripts', 'minors-in-photos')."
        },
        "posture": {
          "type": "string",
          "enum": ["opt-in", "opt-out", "forbidden", "allow"],
          "description": "opt-in = MUST have explicit consent before ingestion. opt-out = ingest by default, MUST honor an opt-out signal. forbidden = MUST NOT ingest under any circumstances. allow = no consent gate (use sparingly, only for clearly user-authored data)."
        },
        "applies_to_pathways": {
          "type": "array",
          "description": "Ingestion pathway ids this consent governs (e.g. 'transcripts', 'narrator-vault').",
          "items": { "type": "string" }
        },
        "applies_to_renderers": {
          "type": "array",
          "description": "Renderer/surface ids this consent governs at output time.",
          "items": { "type": "string" }
        },
        "requires": {
          "type": "array",
          "description": "Required preconditions for ingestion or rendering when posture allows it (e.g. 'redact PII before storage', 'attach source citation').",
          "items": { "type": "string" }
        },
        "rationale": {
          "type": "string",
          "description": "One- or two-sentence reason this posture exists. Helps reviewers reason about exceptions."
        }
      },
      "additionalProperties": false
    },
    "voice": {
      "type": "object",
      "description": "Optional voice/skin definition, used when kind = 'voice-rule'. Renderers consult this to translate the same facts into the configured tone without changing the underlying state.",
      "properties": {
        "skin": {
          "type": "string",
          "description": "Short id for the skin (e.g. 'good-place', 'borderlands', 'neutral')."
        },
        "scope": {
          "type": "array",
          "description": "Renderer/surface ids the voice rule applies to (e.g. 'narrator-brief'). Empty = applies anywhere narrator voice is requested.",
          "items": { "type": "string" }
        },
        "register": {
          "type": "string",
          "enum": ["warm", "neutral", "clinical", "playful", "terse"],
          "description": "Coarse tonal register. Renderers may map this to LLM prompts or template variants."
        },
        "do": {
          "type": "array",
          "description": "Affirmative voice rules ('lead with the body check', 'name the smallest next step').",
          "items": { "type": "string" }
        },
        "avoid": {
          "type": "array",
          "description": "Things this voice must not do ('no ranked priority lists', 'no hustle vocabulary').",
          "items": { "type": "string" }
        },
        "facts_stable": {
          "type": "boolean",
          "default": true,
          "description": "If true (the default), the voice rule MUST NOT alter underlying facts when reframing them."
        }
      },
      "additionalProperties": false
    },
    "pinned": { "type": "boolean", "default": true },
    "stability": {
      "type": "string",
      "enum": ["stable", "evolving", "deprecated"],
      "default": "stable"
    },
    "review_cadence_days": { "type": "integer", "minimum": 1 },
    "created_at": { "type": "string", "format": "date-time" },
    "updated_at": { "type": "string", "format": "date-time" },
    "replaces": {
      "type": "string",
      "description": "Id of a prior doctrine entry this one supersedes."
    },
    "sources": {
      "type": "array",
      "items": { "type": "string" },
      "description": "Hoard ids, file paths, or URLs where the truth originates."
    },
    "renderer_hints": { "$ref": "renderer-hints.schema.json#" }
  },
  "additionalProperties": false
}
